Type,SKU,Name,Published,Visibility in catalog,Short description,Description,Categories,Industries,Category Folder,Product Folder,Images,Regular price,Upsells,Meta: _related_products_source,ACF:banner_image,ACF:hi_left_image,ACF:highlights_content,ACF:right_side_image,ACF_Repeater:Spec_Titles,ACF_Repeater:Spec_Descriptions,ACF:document_content,Name,ACF_Repeater:Document_Names,ACF_Repeater:Document_Files,ACF:faq_content,ACF_Repeater:FAQ_Questions,ACF_Repeater:FAQ_Answers
simple,SKU-ADV-09,108HA / 108HAUN Single Point Load Cell,1,visible,"The Anyload 108HA / 108HAUN is an aluminum single-point load cell available in capacities from 50 kg to 1 tonne, with OIML and NTEP Class III certification and IP66 protection for reliable off-center load performance in mid-to-high capacity commercial applications. The 108HA features metric mounting threads, while the 108HAUN offers UNC imperial threading for North American installations.","<p>The 108HA/108HAUN is a robust mid-to-high capacity aluminum single-point load cell offering NTEP and OIML legal-for-trade accuracy in capacities from 50 kg up to 1,000 kg. The availability of both metric (108HA) and UNC imperial (108HAUN) thread versions makes it uniquely adaptable for scale manufacturers and integrators working across different standards. With a 2.0 mV/V output, IP66 sealing, and 150% safe overload rating, the 108HA/108HAUN provides dependable, accurate service in demanding industrial floor scale, bench scale, and conveyor scale applications where off-center loading is a regular occurrence.</p>
<p><strong>Most Common Applications:</strong> Industrial floor scales, heavy-duty bench scales, conveyor scales, platform scales, OEM mid-to-high capacity scale manufacturing.</p>",Load Cells & Force Sensors > Single Point Load Cells,"Manufacturing, Logistics & Warehousing, Food & Beverage, Agriculture, Retail & Commerce, Chemical Processing",https://www.massload.com/wp-content/uploads/2026/03/108HAUN-load-sensor-single-point.webp,,,woocommerce,,,"<p> <ul>
 <li><strong>50 kg to 1 Tonne Capacity Range:</strong> Covers a wide mid-to-high capacity window ideal for floor scales, industrial platform scales, conveyor scales, and heavy-duty OEM weighing systems.</li>
 <li><strong>Metric (108HA) & Imperial UNC (108HAUN) Thread Options:</strong> Two threading versions simplify integration into both metric and imperial-standard scale structures, making it a flexible choice for global and North American OEM applications.</li>
 <li><strong>OIML & NTEP Class III Certified:</strong> Legal-for-trade approved for certified commercial and industrial weighing across international and North American markets.</li>
 <li><strong>IP66 Environmental Sealing:</strong> Dust-tight and high-pressure water-jet resistant, suitable for busy industrial and commercial environments with regular cleaning routines.</li>
 <li><strong>Superior Off-Center Load Compensation:</strong> Moment-compensated design delivers accurate weight readings regardless of where the load is placed on the platform, critical for floor scale and conveyor scale applications.</li>
 </ul></p>",,Capacities|Accuracy|Safe Overload|Ultimate Overload|Full Scale|Output|Maximum Excitation|Operating Temperature|Compensated Temperature|Sealing Standard|Non Linearity|Material|Protective Coating|Bridge Resistance ,,<p>Not sure if it’s the right fit? Start with the specs below. <p>,108HA / 108HAUN Single Point Load Cell,Datasheet|Technical Drawings,https://www.massload.com/wp-content/uploads/2026/03/Anyload-108HAUN_Datasheet.pdf|https://www.massload.com/wp-content/uploads/2026/03/108HAUN_TechnicalDrawings_50-635kg.rar,,,
simple,SKU-ADV-10,108MA / 108MAUN Single Point Load Cell,1,visible,"The Anyload 108MA / 108MAUN is a simple and affordable aluminum single-point load cell available from 50 to 660 kg, with OIML C3 and NTEP certification and IP66 protection, offering excellent corner error compensation and easy installation. The 108MA uses metric threads while the 108MAUN features UNC imperial threads.","<p>The 108MA/108MAUN is a practical, cost-effective mid-to-high-capacity aluminum single-point load cell that prioritizes ease of installation and reliable off-center load compensation. Spanning 50 to 660 kg, it serves a wide range of commercial and light industrial weighing needs, from retail platform scales to process supervision systems and packaging devices. Its direct interchangeability with big manufactures makes it a practical drop-in replacement for scale service technicians and OEM manufacturers alike, reducing sourcing complexity and downtime during system maintenance or upgrades.</p>
<p><strong>Most Common Applications:</strong> Platform and floor scales, retail trade scales, counting scales, process supervision and packaging systems, OEM scale manufacturing.</p>",Load Cells & Force Sensors > Single Point Load Cells,"Retail & Commerce, Food & Beverage, Manufacturing, Logistics & Warehousing, Chemical Processing, Agriculture",https://www.massload.com/wp-content/uploads/2026/03/108MAUN-load-cell-transducer-single-point.jpg,,,woocommerce,,,"<p> <ul>
 <li><strong>50 to 660 kg Capacity Range:</strong> Broadly covers mid-to-high capacity single-point weighing needs for platform scales, floor scales, process weighing, and packaging systems.</li>
 <li><strong>Metric (108MA) & Imperial UNC (108MAUN) Threading:</strong> Two thread variants serve both global metric-standard and North American imperial-standard scale and OEM manufacturing environments.</li>
 <li><strong>Interchangeable:</strong> Drop-in compatible with major industry-standard models, making it an economical and convenient option for scale upgrades, service replacements, and OEM sourcing.</li>
 <li><strong>OIML C3 & NTEP Certified:</strong> Legal-for-trade approved for certified commercial weighing applications across international and North American markets.</li>
 <li><strong>Simple Installation & Superior Side-Load Resistance:</strong> Straightforward mounting design with excellent performance against corner errors and side loading, minimizing installation complexity and service time.</li>
 </ul></p>",,Capacities|Accuracy|Safe Overload|Ultimate Overload|Full Scale|Output|Maximum Excitation|Operating Temperature|Compensated Temperature|Sealing Standard|Non Linearity|Material|Protective Coating|Bridge Resistance ,,<p>Not sure if it’s the right fit? Start with the specs below. <p>,108MA / 108MAUN Single Point Load Cell,Datasheet|Technical Drawings,https://www.massload.com/wp-content/uploads/2026/03/Anyload-108MA-108MAUN_Datasheet.pdf|https://www.massload.com/wp-content/uploads/2026/03/108MAUN_TechnicalDRawings_50-660kg.rar,,,
simple,SKU-ADV-11,108UA / 108UAUN Single Point Load Cell,1,visible,"The Anyload 108UA / 108UAUN is a versatile OIML and NTEP approved aluminum single-point load cell available from 50 to 1,000 kg, with IP66 protection and compensation for side loading and off-center loads in both static and dynamic weighing applications. The 108UA uses metric threads while the 108UAUN offers UNC imperial threads.","<p>108UA/108UAUN is a highly versatile OIML and NTEP-certified aluminum single-point load cell that covers an impressive 50 to 1,000 kg capacity range while delivering reliable performance in both dynamic and static weighing applications. Its side-load compensation and off-center loading tolerance make it well-suited for the demanding conditions of retail checkout scales, airport baggage systems, postal sorting, packaging devices, and process supervision. The load cell's exceptional interchangeability makes it a preferred sourcing solution for scale manufacturers and service companies worldwide.</p>
<p><strong>Most Common Applications:</strong> Retail checkout scales, airport baggage scales, postal and courier scales, packaging and process scales, conveyor scales, OEM platform manufacturing.</p>",Load Cells & Force Sensors > Single Point Load Cells,"Retail & Commerce, Aviation, Logistics & Warehousing, Manufacturing, Food & Beverage, Pharmaceutical","https://www.massload.com/wp-content/uploads/2026/03/108UAUN-single-point-load-cell.png,
https://www.massload.com/wp-content/uploads/2026/03/108UAUN-Single-Point-Load-Sensor.png",,,woocommerce,,,"<p> <ul>
 <li><strong>50 to 1,000 kg Versatile Capacity Range:</strong> One of the broadest ranges in the 108-series, making it suitable for a wide variety of low-to-medium capacity commercial and industrial platform weighing applications.</li>
 <li><strong>Metric (108UA) & Imperial UNC (108UAUN) Threading:</strong> Available in both metric and UNC imperial thread versions for seamless integration into global and North American scale manufacturing and service environments.</li>
 <li><strong>OIML & NTEP Class III Certified:</strong> Legal-for-trade approved for certified commercial and industrial weighing across international and North American markets.</li>
 <li><strong>Compensated for Side Loading:</strong> Engineered to perform reliably in dynamic and static applications where off-center and side loads are common, including conveyor scales, retail checkouts, and process weighing.</li>
 </ul></p>",,Capacities|Accuracy|Safe Overload|Ultimate Overload|Full Scale|Output|Maximum Excitation|Operating Temperature|Compensated Temperature|Sealing Standard|Non Linearity|Material|Protective Coating|Bridge Resistance ,,<p>Not sure if it’s the right fit? Start with the specs below. <p>,108UA / 108UAUN Single Point Load Cell,Datasheet,https://www.massload.com/wp-content/uploads/2026/03/Anyload-108UA-108UAUN_Datasheet.pdf,,,
